{"schema_version":"unirouter.source-evidence.conformance-projection.v1","product":"unirouter","component_contract":{"id":"unirouter.source-evidence.component-package.v1","sha256":"sha256:99cfa123a93ec7464cfd0228143d59bf579621095cdf69337109e0d5d4ed803e"},"product_authority":{"component_verification_receipt":{"schema_version":"unirouter.source-evidence.component-verification-receipt.v1","sha256":"sha256:f27e0f4ba98192aa627584b1c68ef3ebda3bb761290dac203477d5ab79b03525"},"installed_release":{"schema_version":"unirouter.release-state-identity.v1","sha256":"sha256:0b28c140c3a2835480896cf4d64e726300ef67d4a7cf779138e2fca032d23f35"},"verifier_release":{"id":"unirouter.source-evidence.component-verifier.v1","sha256":"sha256:e025f6856da514a954cdd8b75f761ce5eb4fc1abe898578c051aa32714966df8"},"integration_control_pin_sha256":"sha256:51ca89ef23eefc793bb05c03083e8a0f545eb59e54820fb16dffcd91e8fe8e4a"},"neutral_chain":{"campaign_manifest_sha256":"sha256:dbb526eb32c89b1f4771b6be265c28235ead650a1ab51557c48250cb04520a5c","unirouter_acknowledgement_sha256":"sha256:b420aeac0b384456bb3986630cd9120e9516ae9b2e11e138b874d59ebcc44566","xinsight_acknowledgement_sha256":"sha256:1ec9bc8601e8221bff01b343f4784af8cdd84a1a858facbe71edb9ccc65056d6","authorization_sha256":"sha256:c05636524e3b5513a01d4705fc70c562b344ba28690aafa12c7c37dc5792d1a3","authorization_signature_sha256":"sha256:8f550ed24bdf7a9d8b93c298ff45acc8a9bb2c0c53b389bbd25a1ef869b92ec3","authorization_trust_set_sha256":"sha256:04ba7195ca7bfc73affad1e727fd31cc4265e91224cde79e45195f41b73c0542"},"source_authority":{"source_binding_sha256":"sha256:c8959a370ae9955df2d732897a9ed24ffff0a2b1d03844dd9ff3dbb8607f9020","signer":{"purpose":"source_evidence","domain":"unirouter.source-evidence.component.v1","signing_key_ref":"source-evidence-conformance-05","signer_public_key_id":"ed25519:sha256:a294e178d8c527e23c15fd2e7d5ff9627d29d0813745eeb35bb13250b704f8d6","trust_set_sha256":"sha256:9a32b63baca57f9eeef2047c74e52c6a759cc3e336d35abadcc09b4cc30f96d8"}},"package":{"sha256":"sha256:42466d9a588503ca9978e4659ceff7a817cdf2f94dd744083f14b0f4e6899c09","bytes":2618,"manifest":{"schema_version":"unirouter.source-evidence.component-manifest.v1","sha256":"sha256:52f87dc3d666a28662888541225a09440d7a767e443d5432b917084afd69fa81","created_at":"2030-01-01T00:05:00Z"},"claim":{"scope":"unirouter.poc-source-facts.v1","state":"complete","nested_execution_evidence_v2":"partial","runtime_close_marker_available":false}},"capability_boundary":"offline_files_only"}